,JobId,job_descriptions,job links,job titles,Posted By
22,22,"DESCRIPTION:

Are you ready to unleash your technical creativity? Innovation is the driving force behind everything we do at P&G. Across the world, you will find thousands of scientists, engineers and developers working in manufacturing plants, innovation centers and distribution facilities. You’ll be in the ideal place to work on ground-breaking improvements related to the manufacturing and processing of our leading products with smart, connected technologies driving the 4th industrial revolution. Our aim is to ignite your potential and equip you to enhance the capability, safety, and productivity of all our systems while reducing cost and boosting sustainability. Your role as a process engineer: you will typically start as a technical engineer working with a broad range of processing equipment with specific responsibilities from day 1 on a key project that will involve the following

design and evaluate technical options for achieving business objectives
study technical feasibility using high end computer modelling and simulation.
lead economic evaluations and consultations with manufacturing, research & development and other contributing groups.
design, develop and procure new processing equipment.
develop and conduct acceptance tests on equipment purchased from vendors.
lead new equipment commissioning in the production plants and train the production teams.
solve equipment problems working closely with production staff on new or existing operations. Your first assignment gives you the chance to contribute with your engineering skills to the business from day 1, while developing your leadership skills. You have clear responsibilities that stretch your technical abilities. You will work in professional and entrepreneurial multi-functional teams while receiving valuable mentoring as well as functional and corporate trainings.

Your Role as a Process Engineer:

You will typically start as a Technical Engineer working with a broad range of processing equipment with specific responsibilities from day 1 on a key project that will involve the following working closely with production staff on new or existing operations.

Design and evaluate technical options for achieving business objectives
Study technical feasibility using high end computer modelling and simulation.
Lead economic evaluations and consultations with Manufacturing, Research & Development and other contributing groups.
Design, develop and procure new processing equipment.
Develop and conduct acceptance tests on equipment purchased from vendors.
Lead new equipment commissioning in the production plants and train the production teams.
Solve equipment problems

Your first assignment gives you the chance to contribute with your engineering skills to the business from day 1, while developing your leadership skills. You have clear responsibilities that stretch your technical abilities. You will work in professional and entrepreneurial multi-functional teams while receiving valuable mentoring as well as functional and corporate trainings.

WHAT WE LOOK FOR:

Recent Graduate in one of the following engineering majors: Mechanical, Electrical, Electronics, Industrial, Mechatronics or any relevant engineering degree with 1 – 4 years of relevant experience (preferred).
In addition to good knowledge of English, we also look for skills such as technical curiosity, creativity, innovation, initiative, communication, leadership, and the ability to work with others.

WHAT WE OFFER:

A wide range of CHALLENGING ASSIGNMENTS in one of the most influential companies in the world. We don’t just offer a job; we offer a career with varying assignments and lots of development opportunities

an opportunity for you to develop and deliver STATE OF THE ART TECHNOLOGIES supported by multi-million capital investments.
TRAVEL OPPORTUNITIES to the project locations to see your design come to life
CONTINUOUS COACHING – you will work with passionate people and receive both formal training as well as day-to-day mentoring from your coach and manager
DYNAMIC AND RESPECTFUL INTERNATIONAL WORK ENVIRONMENT – employees are at the core, we value every individual and encourage initiatives, promoting agility and work/life balance.
a COMPETITIVE COMPENSATION PACKAGE , in line with your qualifications and experience.

JUST SO YOU KNOW:

We are an equal opportunity employer and value diversity at our company. Our mission of diversity and inclusion is: “everyone valued. Everyone included. Everyone performing at their peak”.

Qualifications

Recent Graduate in one of the following engineering majors: Mechanical, Electrical, Electronics, Industrial, Mechatronics or any relevant engineering degree with 1 – 4 years of relevant experience (preferred).
In addition to good knowledge of English, we also look for skills such as technical curiosity, creativity, innovation, initiative, communication, leadership and the ability to work with others.",https://www.linkedin.com/jobs/view/3074314646/?eBP=JOB_SEARCH_ORGANIC&recommendedFlavor=ACTIVELY_HIRING_COMPANY&refId=3jOhlHoe74bKS3bYyY3%2FLw%3D%3D&trackingId=D7o3yuYk5L5vjZ8qzTNi9w%3D%3D&trk=flagship3_search_srp_jobs,Process Engineer,Procter & Gamble
23,23,"Posted by
M. Shahmeer Amir
3rd Bug Hunter | Cyber Security Advisor GOP |Top 10 Hacker MS/FB | M.Sc InfoSec | Ph.D Blockchain | Engineer | Ironman Enthusiast | CTO | Building Apps for the 22nd Century | Consulting CISO to help secure your Company
Send InMail
The Senior WebRTC C++ Software Engineer, Research & Development position is responsible for researching, prototyping, developing, and testing new technologies and concepts. The engineer implements proof of concepts and helps to craft requirements and design. This position participates in an agile development process to implement new production ready software, or new features to existing software. The focus is mainly on native WebRTC client applications for iOS, Android. As a Senior C++Software Engineer, you will design, develop, maintain, and support software components and common functionality for distributed computational lithography applications.

Role and responsibilities
Design, development, and maintenance of large scale distributed computing software infrastructure and integration with applications and user interfaces
Design, development, and maintenance of platform modules and common functionality for computational lithography applications.
Design, development, and maintenance of a scripting front-end to drive platform and application modules.
Analyze and improve performance and efficiency characteristics of platform components used with the applications.
Work with the system and application product engineering groups to define new common functionality and diagnose problems.
Other duties as assigned
Job description subject to change at any time
Education and experience
·BS/MS in Computer Science, Electrical Engineering or related discipline
·3 years or more experience in C/C++ software development in a commercial setting.
·Knowledge in parallel or multi-threaded (pthreads) programming.
·Experience with Linux network programming (TCP/IP service).

Skills
Working at the cutting edge of tech, you’ll always have new challenges and new problems to solve – and working together is the only way to do that. You won’t work in a silo. Instead, you’ll be part of a creative, dynamic work environment where you’ll collaborate with supportive colleagues. There is always space for creative and unique points of view. You’ll have the flexibility and trust to choose how best to tackle tasks and solve problems.
To thrive in this job, you’ll need the following skills:
·Must be able to manage multiple activities in a dynamic environment.
·Must be able to present ideas and opinions clearly and support opinions with factual knowledge.
·Experience with the complete software development process: requirements documentation, design documentation, functional specification, coding, test plans, etc.
·Knowledge of and experience with system and application performance tuning.
·Knowledge of and experience with large scale software debugging and troubleshooting.
·Can learn and apply new information or skills.
·Ability to complete assignments with attention to detail and high degree of accuracy.",https://www.linkedin.com/jobs/view/3099479223/?eBP=JOB_SEARCH_ORGANIC&refId=3jOhlHoe74bKS3bYyY3%2FLw%3D%3D&trackingId=ewp%2BhCcqg0NRTciQsR2rJQ%3D%3D&trk=flagship3_search_srp_jobs,C++ Developer,Younite Limited
24,24,"Join Barrick at Reko Diq, Pakistan.

Barrick is a multinational mining company with 9 operating Gold Mines, 3 Copper Mines together with various exploration sites across the global.

Our Reko Diq Greenfields Copper project will be one of the largest Copper Mining operations in the world and we are searching for best-in-class people to join us.

This is a remote site location within the desolate areas of Balochistan.

Being Part Of The Project Team And Reporting Into The Engineering Manager - We Are Searching For a Project Engineer - Electrical To

Lead electrical engineering design of the Reko Diq project from feasibility through to project implementation.

Functions / Responsibilities
Management of early stage works for site establishment
Deliver supply input requirements to enable contract tender and management
Feasibility study leadership working with engineering partner for;
Design specifications review and approval
Equipment specifications and option selection
Constructability and maintainability reviews
Power supply options including potential integration with existing in country systems
Implement renewable power source data collection (wind and solar) to enable deign and selection
Develop project plans, schedules and sequencing for relevant project elements to ensure proper planning of all civil related aspects of the project work
Drive value opportunities and quality review through detailed design and project implementation;
Role will report to the Engineering Manager as one of a team of engineering disciples
Skills / Qualifications
Degree in Electrical Engineering
Experience working on project scoping and design of major infrastructure / facility projects
Experience with renewable power design and integration
Experience working on major infrastructure / facility construction
Experience defining design specifications based on site conditions
Experience working in Pakistan
Barrick - becoming the world’s most valued gold and copper mining business.

Job

Capital Projects

Primary Location

Pakistan-Balochistan-Reko Diq

Unposting Date

Ongoing",https://www.linkedin.com/jobs/view/3072097324/?eBP=JOB_SEARCH_ORGANIC&recommendedFlavor=ACTIVELY_HIRING_COMPANY&refId=3jOhlHoe74bKS3bYyY3%2FLw%3D%3D&trackingId=A91sdyJI6xpS7YRLY4htaA%3D%3D&trk=flagship3_search_srp_jobs,Reko Diq - Project Engineer - Electrical,Barrick Gold Corporation
