,JobId,job_descriptions,job links,job titles,Posted By,Posted Time,Employement Status,Location
55,55,"Posted by
Nehal Ahmed
Talent Acquisition at Daraz (Alibaba Group)
Send InMail
ABOUT DARAZ:
Launched in 2012, Daraz is South Asia's online shopping and selling destination of choice – present in Pakistan, Bangladesh, Sri Lanka, Myanmar and Nepal. Supported by a wide range of tailored marketing, data, and service solutions, the pioneering e-commerce ecosystem in South Asia has 30,000 sellers and 500 brands, serving 5 million consumers. With 2 million products available, Daraz offers a diverse assortment of products in categories ranging from consumer electronics to household goods, beauty, fashion, sports equipment, and groceries. Focused on providing an excellent customer experience, it offers multiple payment methods including cash-on-delivery, comprehensive customer care and hassle- free returns. Daraz is owned by Alibaba Group Holding Limited.

At Daraz, we believe in chasing hard towards big goals. By 2022, we have six aspirations to lead Pakistan into the digital era:

1) As the market leader, we will continue to drive 100%+ annual growth of the e-commerce market for the next 4 years.
2) Reach 200,000 active Daraz sellers (all educated through Daraz University).
3) Engage 25 million Daraz users monthly by being relevant, convenient and service-minded.
4) Create 1 million jobs for marketplace participants.
5) Fully digitalize the logistics ecosystem with real-time visibility for customers regardless of location.
6) Introduce digital payments to 10 million new customers.

KEY RESPONSIBILITIES:
Works with Operations Finance teams on financial reporting framework, including integration with ERP systems, and cost posting methodologies.

Framework and General Ledger Cost Accounting
Acts as subject-matter expert for the principles around Daraz’s ERP framework, with in-depth understanding of the General Ledger accounting logic specific to Operations costs.
Develop in-depth understanding of Daraz’s General Ledger accounts, Cost Centers and Departments. Act as focal point to coordinate accounting logic changes, alongside the assessment of impact on financial reports and provide optimal recommendations.
Improves Operations cost visibility by driving changes in ERP principles and Cost Posting guidelines in collaboration with Central Finance team to update and/or standardize existing cost postings guidelines.
Ownership over existing Cost Posting principles and guidelines via relevant offline documentations. Collaborates with Operations Finance to drive cost posting compliance at local level.
Works on development and transition towards automated Cost Posting through integration with source data systems in collaboration with internal (Project Manager, Performance & Planning Analysts and Data Analysts) and external (Finance, Product and Data Engineering teams) stakeholders.

Costing and Financial Reporting
Accountability for the integrity of Operations Unit Item Costing calculation outputs and ownership over its calculation models, documentations and SOPs. Works closely with Operations Cost Analyst to ensure timely update of costing model parameters for accurate calculation outputs.
Collaborates with Project Manager and Data Analyst to develop future improvements for enhancements to the Operations Unit Item Costing calculation logic.
Maintains cost reporting definitions for the P&L statement within Monthly Business Report and responsible for coordinating changes that may impact the integrity of existing definitions.

Project Management
Responsible for leading cost-related projects together with Project Manager and Operations Planning Manager, including overlapping topics that falls within the planning domain. (e.g. inter-month cost forecasting, campaign forecasting)
Manages senior stakeholders to drive alignment on project understanding, scope and success factors.
Manages project deliverables, timelines, risk assessment under a project management framework to ensure quality project delivery within timelines.


REQUIREMENTS:
Bachelor's degree from a top university in Finance, Accounting, Business or equivalent preferred.
Minimum 3 years of Finance, Accounting and/or Consulting experience. Background in E-commerce and/or Operations environment is a plus.
Go-getter attitude, willing to immerse themselves in the business, with a proactive approach to getting things done.
An eye for detail with strong process-oriented mindset.
Superior organizational skills to manage multiple priorities, and the flexibility to adapt to changing scope and evolving business requirements.
Excellent verbal and written communication skills; fluent in English.
Ability to manage and influence stakeholders across management levels.
Proficiency in Microsoft Excel is essential with a basic understanding of SQL.
Prior experience working with projects involving system integrations, cost modelling and financial reporting framework is strongly preferred.",https://www.linkedin.com/jobs/view/3082428978/?eBP=JOB_SEARCH_ORGANIC&recommendedFlavor=SCHOOL_RECRUIT&refId=sHaEmt3DTdvHshZOLktbCw%3D%3D&trackingId=Ac9TDq0T8aKCiMyZ%2Be5g8A%3D%3D&trk=flagship3_search_srp_jobs,General Ledger Manager,Daraz,4 weeks ago,Full-time · Mid-Senior level,"Karāchi, Sindh, Pakistan"
56,56,"Posted by
Haniya Sheikh
Human Resources Manager at Atompoint | Technical Recruiter | HR Operations | Talent Management
Send InMail
Position Overview:
Atompoint is hiring a ""Product Engineering Manager” for our cybersecurity product called 'Cloudnosys’ headquartered in Atlanta which protects your cloud infrastructure from security threats, data loss & compliance risks with real-time monitoring, auditing, & automated remediation.

Position: Product Engineering Manager (ReactJS, NodeJS, Cloud)
Required Experience: 3+ years
Job Type: Full-time - Onsite Opportunity
Seniority Level: Mid to Senior
Industry: Information Technology
Location: Karachi


Job Description:
● Must have a minimum of 3 years of hands-on experience with backend & frontend technologies, especially with Node JS and React JS
● Good to have 1 to 2 years of experience using Firebase (Firestore & Cloud functions)
● Team Management skills. Must have managed a team.
● Prior experience in developing and deploying applications to the cloud (GCP or AWS)
● Solid understanding of using NoSQL databases
● Knowledge about micro-services architecture/ RESTful – web services
● Ability to implement best technical practices and help teams to identify optimal technical solutions.
● Develop and manage well-functioning databases and applications and write effective APIs and documentation.
● Keep job knowledge up to date by studying new development tools, programming techniques, and computing equipment.
● Excellent communication and teamwork skills.
● (Good to have) interest in cyber-security

Required Qualifications:
● Bachelors in computer engineering or related field (optional, you can still apply if you have prior work to show for)

Why join us?
● Market competitive salary + Bonuses
● Vested equity shares
● Benefits include: (24 days paid leaves/ encashment/ medical & accidental insurance).
● Medical & Accidental Insurance
● Learning & rapid growth opportunities.
● Growth Opportunities

To know more about us please visit:
www.atompoint.com
www.cloudnosys.com",https://www.linkedin.com/jobs/view/3124737834/?eBP=JOB_SEARCH_ORGANIC&recommendedFlavor=ACTIVELY_HIRING_COMPANY&refId=sHaEmt3DTdvHshZOLktbCw%3D%3D&trackingId=Q%2F1HsEqQ1xfYXbgQd3GkBQ%3D%3D&trk=flagship3_search_srp_jobs,Product Engineering Manager,Atompoint,1 week ago,Full-time,"Karāchi, Sindh, Pakistan"
57,57,"Grade Level: L3

Location: Islamabad

Function: Digital Financial Services (JazzCash)

What is Product Manager - Cards?

As a product manager for cards at JazzCash, you will be responsible for setting up the strategic direction of the card issuance business, owning the product roadmap and will be responsible for P&L. You will apply different strategies to increase the penetration of cards within the JazzCash wallet base and then increasing the card spend. You will be conducting regular reviews on market trends to identify growth opportunities.

The role reports directly to the Head of Products - Consumer in JazzCash. The Product Manager - Cards will be managing a team of two members.

What does Product Manager - Cards do?
Effective development and delivery of products and features focusing on solving customer problems, acquiring new customers, creating engagement and driving revenues.
Work closely with the senior management to define strategy aligned with JazzCash vision.
Develop and execute growth and engagement plans, drive business performance, and work with cross-functional teams to achieve business KPIs.
Build and own the product roadmap for an area with significant scope.
Drive full deployment of card products and leveraging customer and market insights ensuring competitive positioning aligned with the business roadmap.
Gather requirements, write user stories, and create specifications for stakeholders and the development team.
Make decisions on the team’s priorities to deliver projects with the highest impact in coordination with the product leadership team and key cross-functional teams.
Utilize data analytics to measure outcomes and drive data driven decision making for new features and designing of customer value proposition and customer engagement campaigns.
Deeply understand customer needs by spending time with customers and sales and observing patterns across feedback and the market.
Own complete P&L of cards business, tracking of results and make timely iterations in the plan to ensure business objectives are achieved.
Using your deep knowledge of technology and global payments trends, you are deeply focused on creating business impact by optimizing and innovating the card payments experiences

Jazz is an equal opportunity employer. We celebrate, support, and thrive on diversity and are committed to creating an inclusive environment for all employees.

Requirements

What are we looking for and what does it require to be Product Manager - Cards?
You bring a passion for strong collaboration and solving problems through communication.
You have an analytical and data driven mindset and an excellent understanding of commercial relationship management activities.
Concrete experience in the context of payment cards.
5 + experience defining and driving product strategies in card payments business.
Experience in defining and driving product strategies.
Ability to create best-in-class interfaces that simplify complexity.
Strong written and verbal communication skills.

Experience or shown expertise in:
Product management
Go-to-market
P&L Management
Growth management
Product Proposition (Business model canvass, and story boards)
Mix Panel
Team Management

Benefits

Why Join Jazz?

As one of the leading employers in the country, Jazz epitomizes the philosophy that each Jazz employee is passionately living a better every day inspired and enabled by visionary leadership, a unique professional culture, a flourishing lifestyle, and continuous learning and development.

As one of the largest private sector organizations in Pakistan, our objective is to continue to change the lives of our 74 million customers for the better. This is an opportunity for someone who wants to be part of something transformative, someone who can play a critical role in driving our success. Together, we can empower millions more with the tools necessary to progress in an increasingly digital economy.",https://www.linkedin.com/jobs/view/3121087837/?eBP=JOB_SEARCH_ORGANIC&recommendedFlavor=SCHOOL_RECRUIT&refId=sHaEmt3DTdvHshZOLktbCw%3D%3D&trackingId=POvTxDQX%2FyufvurDgNzyVw%3D%3D&trk=flagship3_search_srp_jobs,Product Manager - Cards,Jazz,1 week ago,Full-time · Mid-Senior level,"Islamabad, Islāmābād, Pakistan"
58,58,"In a world where trades are happening faster than ever to answer our needs, where sustainability is not just an option anymore, clarity and trust in the information we trade with are a must.

So, say hello to Kpler! We exist to facilitate sustainable and efficient trade to meet the changing needs of our world. To do so we've built a Data-as-a-Service solution that does exactly that across the lifecycle of a trade.

Our solution aggregates data from hundreds of sources including radar and satellite imagery as well as logistics, governmental, shipping databases and more. Intelligently connecting the dots across fragmented information landscapes, we bring to our clients a unique, real-time understanding of the trades happening all over the world, by giving them access to live information about the movement of cargos, the availability of vessels as well as the commodity storage.

To support this endeavor we have teams in more than 7 countries and 8 key locations (Brussels, Paris, London, Vienna, Dubai, Singapore, Houston and New York). With individuals of various backgrounds, diverse skills, and international experiences, being global & inclusive is in our DNA!

Our values
Be humble - We always place the interests of the collective before your own.
Respect and care for others - We make every person feel comfortable in their own beliefs, decisions, and perspectives.
Take responsibility - We take ownership of our actions
Act with integrity -We are honest and transparent in all your dealings.
Be bold - We push the boundaries in order to improve and grow.

You’ll get to work in a truly global environment, with more than 30 nationalities speaking more than 15 languages.

What will be your role?

We are looking for a highly motivated IT Operations Analyst to join our IT team and help sustain our rapid growth in Asia and around the world.

As an IT Analyst, you will have the opportunity to collaborate with all of your colleagues worldwide by providing them daily IT assistance and participating in mid-and long-term IT projects. You will also be in constant contact with our Senior staff (IT Manager) and will be trained in our existing IT procedures, policies and systems.

The IT department at Kpler actively collaborates with other technology teams (Engineering) and also admin teams (People and Finance) to streamline processes and develop a great employee experience in a supportive and efficient environment.

What you’ll do
Provide hardware and software support to all Kpler offices and remote workers (troubleshooting, access creation/deletion, etc.)
Administrate our various SaaS productivity tools (Google Workspace, Slack, Okta, Expensify, BambooHR, Shortcut, etc.)
Manage our IT inventory and maintain IT asset data (serial numbers, software keys, locations, etc.)
Help with IT procurement - laptops, phones and accessories (mainly in Asia)
Take a role as part of various ongoing projects (IT security, SSO, MDM, new offices, new solutions deployment)
Participate in the remote maintenance of our offices’ network infrastructure when necessary (Singapore office and other co-working places, Brussels headquarters, …)
Improve and document hardware/software processes and policies (support, security, renewal, etc.)
As part of the IT team, manage and improve the onboarding/off-boarding processes (hardware procurement, credentials management, laptop and phone configuration)

You may be a fit if...
You have at least 2 years of experience in IT management, IT technical support/help desk, networks and/or IT systems administration and configuration
You speak fluent English. Working knowledge of Chinese or Japanese is a plus
You have a good understanding of computer hardware and OS (Windows / macOS)
You have good network operations knowledge (TCP/IP, LAN/WAN, wireless networks, etc.)
You have a good understanding of IT security best practices
Some working experience with Google Workspace, Slack, Okta and/or Office 365 is a plus
You have great customer service skills and you are always ready to help your coworkers
You are adaptive, resourceful and very well organised
You are autonomous, flexible and can self - prioritise tasks
You are a fast learner

Our People Pledge

Kpler is committed to providing a fair, inclusive and diverse work-environment. We believe that different perspectives lead to better ideas, and better ideas allow us to better understand the needs and interests of our diverse, global community. We welcome people of different backgrounds, experiences, abilities and perspectives and are an equal opportunity employer.",https://www.linkedin.com/jobs/view/3077949652/?eBP=JOB_SEARCH_ORGANIC&recommendedFlavor=ACTIVELY_HIRING_COMPANY&refId=sHaEmt3DTdvHshZOLktbCw%3D%3D&trackingId=A0OTl20rXLO%2FmqRvGNXb%2BQ%3D%3D&trk=flagship3_search_srp_jobs,IT Operations Analyst,Kpler,1 month ago,Full-time · Associate,South Asia
59,59,"Grade Level: L3

Function: Digital Financial Services (JazzCash)

Location: Islamabad

What Is Manager Product Experience & Design

As a lead of JazzCash Product Experience & Design team, you’ll participate in every aspect of the customer experience — with a strong focus on user research and interface design. You’ll be a fearless advocate for our users, pushing every feature and interaction to be as impactful as possible. You’ll work closely with the Head of Product Planning & Design and the product teams to concept, test and design experiences that convert and grow our business and make life easy for our millions of users.

The role reports directly to the Head of Product Planning & Design

What does Manager Product Experience & Design do?
Participate in the overall strategy and roadmap of the design team
Set the design strategy and direction of JazzCash platforms
Manage and mentor our team of designers and UX researchers
Collaborate with the product team to help develop sprint plans and design priorities
Work with designers and product managers to ensure design solutions are aligned with our sprint and/or long-term strategic goals
Ensure the overall quality of the design solutions the team works on
Partner with technology teams to ensure the overall quality of what we ship to users
Continuously improve and evolve JazzCash’s research & design methodologies
Manage and mentor our team of designers

Jazz is an equal opportunity employer. We celebrate, support, and thrive on diversity and are committed to creating an inclusive environment for all employees.

What are we looking for and what does it require to be an Expert Product Experience & Design
Outstanding portfolio of prior work that demonstrates strong UI/UX capabilities
8+ years of professional experience as a product designer
Exceptional craft and executional design skills
Experience managing and mentoring teams
Deep understanding of UX strategy and product design methodologies
Ability to translate problem statement and user insights into design solutions
Experience working in agile and lean environments
Strong command of design & prototyping software: Figma, After Effects, Miro etc.

Why Join Jazz?

As one of the leading employers in the country, Jazz epitomizes the philosophy that each Jazz employee is passionately living a better every day inspired and enabled by visionary leadership, a unique professional culture, a flourishing lifestyle, and continuous learning and development.

As one of the largest private sector organizations in Pakistan, our objective is to continue to change the lives of our 72 million customers for the better. This is an opportunity for someone who wants to be part of something transformative, someone who can play a critical role in driving our success. Together, we can empower millions more with the tools necessary to progress in an increasingly digital economy.",https://www.linkedin.com/jobs/view/3088552633/?eBP=JOB_SEARCH_ORGANIC&recommendedFlavor=SCHOOL_RECRUIT&refId=sHaEmt3DTdvHshZOLktbCw%3D%3D&trackingId=rVMnG%2FDh8G9NvevzoOECqA%3D%3D&trk=flagship3_search_srp_jobs,Manager Product Experience & Design,Jazz,1 month ago,Full-time · Mid-Senior level,"Islamabad, Islāmābād, Pakistan"
