,JobId,job_descriptions,job links,job titles,Posted By,Posted Time,Employement Status,Location
40,40,"S&P Global Corporate

The Role: Learning Program Manager - Instructional Designer

The Team: The EssentialTECH team is a high-performing group of L&D and program management professionals, dedicated to providing superior learning and skills application experiences that align with business needs and strategy. We are committed to promoting learning as a core part of our company culture by delivering opportunities that promote excellence, enable sustained business success and empower employees around the globe to fulfil their career potential.

The Impact: You will have a unique opportunity to help S&P Global employees prepare for the future of work, with a particular focus on developing information security awareness and skills to meet business and risk objectives. You will be part of a global team that is committed to working with creative methods that empower employees to take charge of their learning−your work will have a direct impact on company-wide information security objectives.

As a learning program manager you will support S&P Global cross-divisional operations, product and technology teams to create a best-in-class performance culture to power the markets of the future and support employees to deliver on the business strategy and the vision for the future.

What’s in it for you: As a learning program manager you will be part of an Agile team that delivers programs and resources for increasing employee technical knowledge/skills. Because EssentialTECH programs support our rapidly growing business, you’ll be exposed to some pretty cool technologies and frameworks. In this this high-profile program, you will interact with and work alongside innovative, driven executives and leaders and also gain exposure to the workflows and activities of employees across all S&P Global divisions and locations.

Responsibilities: The Learning Program Manager leads the development, maintenance and delivery of employee targeted, instructor-led and technology deployed training content and solutions. This role will build & grow a cyber security awareness program in alignment with the CISOs priorities and mandate. You will collaborate closely with internal subject matter experts to determine needs, design curriculum, curate or develop content, ensure quality of delivery and work with company leadership to validate program alignment with business needs.
Create engaging learning activities and compelling course content
Work with subject matter experts to identify the target audience’s training needs; Perform learning needs analysis to inform creative approaches to educational program design and to define appropriate L&D deliverables
Work with creative teams to create and integrate multimedia elements such as audio and video into eLearning modules, workshops and other educational presentations
Interface with third parties to curate and manage educational offerings and ensure alignment with the EssentialTECH brand and approach.
Facilitate the efforts of training-related project teams from project inception to completion – includes stakeholder management and project management (create schedule, manage project timeline and proactively utilize both quality control and risk management activities; track and report on project milestones)
Develop metrics, reporting, recognition and remediation based on phishing exercise results and training program impact; Monitor, evaluate and analyze business impact and the practical, on-the-job application of delivered learning programs.
Create and implement plans/processes/activities to engage employees with the practice and application of acquired skills and knowledge
Administer LMS course- and report-related functions
Basic Qualifications

What We’re Looking For:
Bachelor's degree in organizational development, business, education, instructional design, graphic design or other learning discipline
Minimum 3 years of experience and proven success working within a corporate L&D environment including application of instructional design skills and familiarity with adult learning principals
Ability to manage competing priorities; ability to have multiple projects in flight at once and in various stages
Ability to bring together sound learning principles, agile methods, learning technology and program management skills in the design, development and execution of learning programs
Collaborative work style with ability to adapt to change, solicit input, influence, and support decision-making
Proven success working with senior stakeholders; influencing decisions and direction
Excellent listener; seeks broad input and feedback; employs frequent and effective follow-up
MUST HAVE solid written & verbal communication skills for storytelling and story boarding
Working knowledge in developing content in L&D authoring tools. (i.e. Articulate)
Preferred Qualifications

The following would be considered assets to the role
Experience working cross-culturally with varied colleagues in a global environment
Creative problem solver; naturally curious and can quickly research ideas and issues
Developing education for a corporate audience
Willingness and ability to travel domestically and internationally on rare occasions
Flexible Working (optional)

We pride ourselves on our agility and diversity, and we welcome requests to work flexibly. For most roles, flexible hours and/or an element of remote working are usually possible. Please talk to us at interview about the type of arrangement that is best for you. We will always try to be adaptable wherever we can.

Return to Work

Have you taken time out for caring responsibilities and are now looking to return to work? As part of our Return to Work initiative (link to career site page when available), we are encouraging enthusiastic and talented returners to apply, and will actively support your return to the workplace.

Grade/Level GL 10

The Location: Argentina/India/Pakistan/Philippines/United States/Canada

About Company Statement: At S&P Global, we believe in putting our ""People First"". Some of our benefits include unlimited vacation days, 5 Wellbeing days throughout the year to rest and recharge, 6 months of parental leave, and wellness activity reimbursement. Please visit the following link to learn more:

https://spgbenefits.com/benefit-summaries/us#Global_Benefits_Career_Coaching

S&P Global delivers essential intelligence that powers decision making. We provide the world’s leading organizations with the right data, connected technologies and expertise they need to move ahead. As part of our team, you’ll help solve complex challenges that equip businesses, governments and individuals with the knowledge to adapt to a changing economic landscape.

What's In It For You
Compensation/Benefits Information (US Applicants Only): S&P Global states that the anticipated base salary range for this position is $59,800-$124,200.
A comprehensive, benefits package that includes medical, dental, vision and life insurance plans, paid time off, a generous 401k match with no vesting period, parental leave and 3 volunteering days each year. For more information on benefits, please access the benefits page on our careers site: https://www.spgbenefitessentials.com/newhires.
Equal Opportunity Employer

S&P Global is an equal opportunity employer and all qualified candidates will receive consideration for employment without regard to race/ethnicity, color, religion, sex, sexual orientation, gender identity, national origin, age, disability, marital status, military veteran status, unemployment status, or any other status protected by law. Only electronic job submissions will be considered for employment.

If you need an accommodation during the application process due to a disability, please send an email to: EEO.Compliance@spglobal.com and your request will be forwarded to the appropriate person.

US Candidates Only: The EEO is the Law Poster http://www.dol.gov/ofccp/regs/compliance/posters/pdf/eeopost.pdf describes discrimination protections under federal law.

202 - Middle Professional (EEO Job Group) (inactive), 20 - Professional (EEO-2 Job Categories-United States of America), OPRTON202.1 - Middle Professional Tier I (EEO Job Group)

Job ID: 272572

Posted On: 2022-06-15

Location: Buenos Aires, Argentina",https://www.linkedin.com/jobs/view/3114410036/?eBP=JOB_SEARCH_ORGANIC&recommendedFlavor=SCHOOL_RECRUIT&refId=eDGYXhWIbhFwEwWHhFObgw%3D%3D&trackingId=ABADrsgHQ%2B0dioMIZ55Taw%3D%3D&trk=flagship3_search_srp_jobs,Learning Program Manager - Instructional Designer,S&P Global,2 weeks ago,Full-time,"Islamabad, Islāmābād, Pakistan"
41,41,"Pathfinder Overview:

Pathfinder International is a global leader in SRHR. We place reproductive health care at the center of all that we do—believing that it is not only a fundamental human right, but is critical for expanding life opportunities for women, families, communities, and nations, and paving the way for transformations in environmental stewardship, decreases in population pressures, and innovations in poverty reduction. Pathfinder provides women, men, and adolescents with a range of quality health services—from contraception and maternal care to HIV prevention and AIDS care and treatment. Pathfinder strives to strengthen access to family planning, advocate for sound reproductive health policies, and, through all of our work, improve the rights and lives of the people we serve.

Key Performance Areas

Major Activities / Responsibilities

Strategy Development and Implementation

Leads in the development and implementation of programs and services that are in line with the overall strategic plan of Pathfinder and the context in the country/region. Facilitates the alignment of Pathfinder area programs to strategic priorities and accountability mechanisms provided in Pathfinder programming framework. Leads, directs and mentors the country staff in line with the organizational strategy

Brand Ambassador

Represents Pathfinder in the assigned country and manages host country relations and Pathfinder interests in dealing with government, international and local organizations, networks and media in the program areas. Develops and strengthens relationships with local organizations and networks and establishes national and regional strategic relations and alliances with partners working in common cause with Pathfinder objectives. Promotes Pathfinder’s organizational identity and capacity to all stakeholders and partners in the assigned country and ensures Pathfinder remains relevant to the changing needs of key stakeholders in the country

Program Development, Management & Evaluation

Leads in the development of the country’s Pathfinder programs. Oversees and coordinates the Pathfinder portfolio to ensure the highest level of project quality and accountability, while fostering continuity through building and developing local capacity. Leads the development, implementation and monitoring of research and advocacy plan on issues of relevance in the country aligned with Pathfinder’s global programmatic and policy priorities. Provides continuous monitoring and support to offices and existing projects, coordinates program reviews, evaluations, and follow up implementation of evaluation findings in close collaboration with MEL and Chief Programs and Impact Officer. Coordinates the production of timely quality program reports in line with Pathfinder and donor requirements.

Funding and Grants Management:

Develops networks and partnerships with national/regional/international institutions in assigned country and spearheads donor collaboration, fund raising and project development within the country. Undertakes diversified local and international fundraising initiatives to strengthen program funding and sustainability. Coordinates the production of good quality funding proposals and responds to calls for proposals. Facilitates donor visits, donor meetings, round table discussions and evaluations. Ensures that effective grant management systems are in place and are consistent with Pathfinder’s fund seeking and management policy.

Business Development and Growth

Takes a business approach towards the development of the country portfolio to demonstrate Pathfinder’s capacity to new, diverse and nontraditional donors. Applies innovative lens to promoting and visbilizing the work of the organization, identifies new opportunities for research and growth in new existing markets. Prepares and deliver impactful pitches and presentations with the support of the Marketing team and develops multiple channels of communications with key existing and potential stakeholders for positive, long-lasting relationships

Financial Management and Internal Audit:

Provides oversight to all finance and administrative services for the country office. Ensures effective implementation and compliance with procedures required by grant or contract agreements. Oversees the development and implementation of annual country budgets. Ensures that adequate internal control mechanisms and budget monitoring and review mechanisms are in place. Oversees annual and project-specific audit processes. Ensures the preparation, accuracy and timely submission of financial reports that comply with grant or contract agreements and ensures compliance with all aspects of Pathfinder policies and donor funding. Checks and verifies all inventories and promotes efficient management of organizational assets.

Human Resources Management and Organizational Development

Provides leadership support to country staff and promotes best practices in human resources management. Coordinates regular reviews and updates of HR policies and procedures and ensures compliance with HR management practices and the national labor laws. Oversees adequate implementation of the performance management system including performance objectives and planning, review, appraisal and staff development. Oversees and monitors efficiency and fairness of recruitment processes. Provides coaching and counselling advice to staff when necessary and leads initiatives to develop staff capacity. Organizes regular meetings to exchange information, coordinate projects, events and activities, and for learning.

Information, Communication and Learning

Ensures that Pathfinder programs are maintaining a coordinated and agreed upon information exchange both internally and in its dealing with external parties. Ensures that all communication infrastructures are set up and smooth information flow is maintained. Ensures that experiences and best practices are documented and shared across the organization

Project Management and Participation

Ensures the development and maintenance of a strong internal compliance system for the country offices that enhance the likelihood of achieving organizational objectives, mitigating risks, and improving performance. Ensures highest level of adherence with Pathfinder and donor policies. Models and promotes leadership that respects and upholds Pathfinder’s policies, code of conduct and organizational values. Leads, manages or participates on cross-functional project teams

Minimum Education and Work Experience:
Bachelor’s degree in public health, business, marketing, social science or related discipline.
10 years’ experience in managing global and local business relationships and funds in large, international organizations; proven experience in proposal development from concept note to full proposal
10 years’ experience in developing and implementing innovative strategies of resource mobilization with a proven record in raising substantial research/development funds, and a proven record in research and advocacy.
10 years’ experience managing and developing direct reports
5 years’ international non-profit experience
5 years’ experience in program management in the INGO sector

Preferred Education and Work Experience:
Prefer: Master’s degree
Prefer: Experience with USAID-funded projects
Prefer: Experience managing large, complex family planning and cross-sectoral projects while living in developing countries
Prefer: Experience of working in the private sector and engagement with private sector partners, donors and programs

Competencies/Attributes:

Minimally Required Job-Specific Competencies:
Country Specific Public Health System: Deep knowledge of the assigned country's public health system.
Sexual and Reproductive Health and Rights Services: Deep knowledge of family planning and reproductive health principles, practices and services of programs, including program strategies and indicators, and the latest professional developments in SRHR. Proven skills in designing, implementing, monitoring, and evaluating development and intervention activities, preferably with USAID, WHO, or other donor organizations working in the health sector.
Program Operations and Development: Demonstrable knowledge of implementing and managing similar program operations in the developing world including advocacy
Proposal Development: Mastery of skills in proposal development from concept to full proposal, resource mobilization, and proven ability to raise substantial research/development funds.
Compliance: Proven ability to manage compliance to diverse donors.
Leadership: Mastery of skills as a leader in health and health service delivery strengthening in developing countries and proven ability as a senior manager, including experience in developing and implementing strategic plans
Business Process Design and Improvement: Proven ability to facilitate groups to identify business process issues and improvement objectives; ability to operationalize process improvements.
Management and Supervision: Proven ability to lead, manage, and develop direct reports within a matrix culture.
Program and Project Planning and Management: Deep skills in program and project management and planning to fulfill performance objectives, including the timely implementation and reporting of donor-funded program activities.
Operations and Financial Management: Deep knowledge of operations and financial management in developing countries.
Presentation Skills: Proven ability to make presentations on results and products to small and large groups of diverse backgrounds
Community Relations: Mastery of skills in facilitating working relationships between partners, government officials, and communities.
Change Leadership: Ability to demonstrate a high degree of flexibility in managing change across a broad group of stakeholders in an inclusive manner.

Minimally Required Organizational Competencies:
Languages: Proven writing and speaking skills using local languages and English language
Communication and Influencing Skills: Proven ability to influence others through diplomacy and proven oral and written communication skills.
Passion for Sexual and Reproductive Health: Demonstrated commitment to family planning, reproductive health services, gender, maternal, child health services, and eradication of harmful traditional practices.
Software Applications: Advanced knowledge of MS Excel, PowerPoint, Word and Outlook.
Self-Management and Teamwork: Ability to work independently or as a member of the team, ability to thrive in a matrix organization, ability to be detailed-oriented, and ability to manage stress effectively in a fast-paced environment.
Matrix Management: Ability to thrive in a matrixed organization.
Confidentiality: Ability to maintain confidentiality on work-related matters.

Other Information:
Travel required (40% or less)
Uses cellular and office phone, laptop or desktop computer

Other Information:
This job description format focuses on the main duties of the position and is not intended to list every potential task or assignment.

Duties can and will change to meet the changing priorities of the department and organization.

Pathfinder is committed to the safeguarding and protection of the people we serve and our staff. We have zero tolerance for any type of behavior that inflicts harm on children, young people, adults, our staff and partners including sexual abuse, harassment, bullying, and exploitation. We do everything possible to ensure that we recruit only those who are suitable to work with for us and expect that everyone we hire will abide by our safeguarding and related policies and will report any suspected or known violations. This job is subject to a range of vetting checks as legally permitted in the country where they are being hired.

By submitting an application, the job applicant acknowledges they understand our intent to verify suitability to work with us.",https://www.linkedin.com/jobs/view/3122812339/?eBP=JOB_SEARCH_ORGANIC&recommendedFlavor=ACTIVELY_HIRING_COMPANY&refId=eDGYXhWIbhFwEwWHhFObgw%3D%3D&trackingId=ecYrUcK8lWQ5P0sJ5oUZ9A%3D%3D&trk=flagship3_search_srp_jobs,Country Director,Pathfinder International,5 days ago,Full-time · Director,"Karāchi, Sindh, Pakistan"
