,JobId,job_descriptions,job links,job titles,Posted By
96,96,"INTECH is looking for a talented and driven software Product Manager to join our team. You will work with INTECH's Digital Solutions team to invent, design, and build software products to revolutionize the way industrial companies operate.

In your role as a Product Manager, you will work with INTECH's domain experts in areas such as Cyber Security, Operations Management, and Field Service Management to define, develop, and grow products for our customers.

We are looking for individuals with experience in software product management and a keen desire to interact directly with customers and develop a sense of the commercial side of building products.

Requirements:

Identify opportunities, build product vision and understand market needs, roadmap, and strategy
Research customer and user needs, write user stories, partner with the user experience team for rapid prototyping, and work with the team to develop marketable products
Develop presentations and product specifications. Support in developing marketing collateral.
Ability to understand technical challenges and make educated trade-offs in features in the development journey.
Work with a functional team to design and productize a world-class solution
Collect and synthesize inputs from sales, business units
Partner with cross-functional teams to ensure quality product output, timeliness, and client requirements
Be the Company’s Product Evangelist
Knowledge of product strategy changes as a result of competitive changes in the marketplace
Team up with design engineers and visit customers to propose product solution
Contribute to and create other marketing communications strategies
Should be able to develop the application experience, with mock applications etc
Technical degree, with a preference for master’s level",https://www.linkedin.com/jobs/view/3073110631/?eBP=JOB_SEARCH_ORGANIC&recommendedFlavor=SCHOOL_RECRUIT&refId=48KsD0e3oD1SN7PhHYXUKQ%3D%3D&trackingId=FpfMI9oP5bU%2FC8IBMeSsRA%3D%3D&trk=flagship3_search_srp_jobs,Product Manager – Digital Solutions,INTECH Process Automation
97,97,"Posted by
humza shah
Student at University of Engineering and Technology, Lahore
Send InMail
Come work at IZU Enterprises the leading company in our industry in the tri-state area. We're proud of our employees. We are looking to hire an experienced Customer Sales Representative to join the IZU Enterprises. If you're serious about your next job, IZU Enterprises is an ideal company for you. Apply today!
Responsibilities:
Present, promote, and sell products/services using solid arguments to existing and prospective customers
Perform cost-benefit and needs analysis of existing/potential customers to meet their needs
Establish, develop and maintain positive business and customer relationships
Expedite the resolution of customer problems and complaints to maximize satisfaction Requirements:
knowledge of MS Office
Familiarity with BRM and CRM practices along with the ability to build productive business professional relationships
Excellent selling, communication, and negotiation skills
Prioritizing, time management, and organizational skills
Ability to create and deliver presentations tailored to the audience needs
Relationship management skills and openness to feedback
Intermediate, BS/BA degree or equivalent
Excellent interpersonal skills
Fluent English
Perks and Benefits:
Dinner
Saturday Sunday off
Lenient Environment
Friendly Staff
Semi-annually Tours
Gaming Competition/Play Station
BBQ Nights

Location: Raiwind Raod Lahore
Timings: 6pm-3am (MON-FRI)",https://www.linkedin.com/jobs/view/3102020562/?eBP=JOB_SEARCH_ORGANIC&recommendedFlavor=JOB_SEEKER_QUALIFIED&refId=48KsD0e3oD1SN7PhHYXUKQ%3D%3D&trackingId=7pGYCON6WqB5vMg0k2Z7kw%3D%3D&trk=flagship3_search_srp_jobs,Customer Sales Representative,IZU Enterprises
98,98,"Position Snapshot

Location: Head Office, Lahore

Company: Nestlé Pakistan

Full-time

Position Summary

Be an E-Commerce champion, leading channel & customer management for E-Commerce (e.g. achievement weekly/monthly sales targets, activity finalization with business, e-Content management, etc.).

A day in the life of...

Define strategies and plans that deliver Category growth based on e-shopper and eRetailers requirements
Champion online tools and ensure online picture of success across all eRetailers in the market (eContent, Share of Search, Right Assortment, Right Placement)
Coordinate with brand teams, recommend and execute online activities based on eShopper knowledge. Ensure all promotional investment is properly reviewed and evaluated with proper ROI working.
Ensure effective utilization of allocated Budgets.
Lead the innovation and marketing activation initiatives.
Drive conversion marketing and liaison with media team to ensure digital execution as per aligned plans

What Will Make You Successful
Bachelor’s degree in Sales/Marketing or business-related
1-2 years of experience in eCommerce function or company, and over this period has successfully delivered on KPIs
Experience in sales is a plus
Capacity to understand all sales functional areas i.e. Channel & Category Sales Development (CCSD), Customer relationship, Distribution handling",https://www.linkedin.com/jobs/view/3090397418/?eBP=JOB_SEARCH_ORGANIC&recommendedFlavor=SCHOOL_RECRUIT&refId=48KsD0e3oD1SN7PhHYXUKQ%3D%3D&trackingId=bLRzQrNV%2FD%2F5qGfJpTDNpQ%3D%3D&trk=flagship3_search_srp_jobs,E-Commerce Specialist,Nestlé
99,99,"Overview

Arkhitech/Simobo is seeking a Business Growth Officer for its Retail and Restaurant Management and POS Solutions, Howmuch (https://www.howmuchpos.com) and Foodnerd (https://www.foodnerdpos.com).

Major Duties & Responsibilities
Set up hardware and install and configure software and drivers.
Maintain and repair technological equipment (e.g. routers) or peripheral devices.
Install well-functioning LAN/WAN and other networks and manage components (servers, IPs etc.).
Perform regular upgrades to ensure systems remain updated.
Troubleshoot system failures or bugs and provide solutions to restore functionality.
Arrange maintenance sessions to discover and mend inefficiencies.
Offer timely technical support and teach users how to utilize computers correctly.
Close new business deals by coordinating requirements; developing and negotiating contracts; integrating contract requirements with business operations.
Protects organization's value by keeping information confidential.
Enhance organization reputation by accepting ownership for accomplishing new and different requests; exploring opportunities to add value to job accomplishments.
Adhering to company's policies, standards and procedures in the performance of job duties.
Qualifications
Proven experience as computer technician or similar role.
Thorough knowledge of computer systems and IT components.
Good knowledge of internet security and data privacy principles.
Excellent troubleshooting skills.
Exceptional organizing and time-management skills.
Strong verbal and written communication skills are critical.
Relevant certifications (e.g. CompTIA A+) will be an advantage.
Experience/Knowledge of Hubspot CRM is a plus.
Key Benefits
Competitive commission structures that reward your work
Bonuses and Commissions
Accelerated learning and career growth!",https://www.linkedin.com/jobs/view/3091903023/?eBP=JOB_SEARCH_ORGANIC&recommendedFlavor=JOB_SEEKER_QUALIFIED&refId=48KsD0e3oD1SN7PhHYXUKQ%3D%3D&trackingId=L7KBUJdYg9tmxCzxWyCA8w%3D%3D&trk=flagship3_search_srp_jobs,Computer Sales and Support Associate,Arkhitech
100,100,"Posted by
Benazir N.
Freelance Recruiter - Recruitment process Outsourcing (RPO) - International Recruitment
Send InMail
You will work on the following tasks while working with us:
You will manage and support lead generation efforts to create more MQLs
Manage Team of Marketing Associates and Officers to improve the lead quality and identify the new sales prospects
You will develop and monitor the team’s KPIs, meet personal targets & work toward the company’s revenue goals and profitability
You will identify opportunities to reach new market segments and expand market share specifically in the DACH region and generally in entire Europe.
You will maintain well organized, up-to-date and accurate lead information and activity reports in the company’s CRM system
You will work closely within the Lead Generation and marketing team and develop cooperative working relationships with all colleagues
You will hold regular meetings with team members to review progress with the lead process, resolve challenges, present possible solutions, and provide necessary training to ensure the team consistently performs above standard

Your Qualification:
You have at least a Bachelor’s Degree in Marketing or a related subject
You have at least 4-5 years of relevant professional experience in prospecting, lead generation and sales management, representing a medium or large organization
You have proficiency in using LinkedIn as a lead generation platform
You have experience in using LinkedIn Sales Navigator and Campaign Manager
You have experience in B2B sales, preferably in Recruitment, IT or Digital Marketing Industries and have the ability to develop a good understanding of customer and market dynamics
You have experience in managing a team of 20 or more people
You have experience in managing the leads or sales pipeline using CRM systems",https://www.linkedin.com/jobs/view/3104635678/?eBP=JOB_SEARCH_ORGANIC&recommendedFlavor=ACTIVELY_HIRING_COMPANY&refId=C1vrF6y%2BPU3G%2FOJ57WtbCQ%3D%3D&trackingId=3%2F8q771BSk98ufuimj9%2FmA%3D%3D&trk=flagship3_search_srp_jobs,Lead Generation Manager Remote | (m/f/d),Outsourcing4work GmbH
101,101,"Zameen.com is looking to hire skilled professionals for its ‘Assistant Manager - Project Sales’ posts.

The applicant selected for this opening will be tasked with selling project property units, paying client visitations, giving demonstrations, carrying out site visits, and closing deals. Further, he (or she) will be responsible for effectively communicating project sales offers, following up with clients for deals maturation/healthy relationship management (and keeping them updated on their chosen property concerns), renegotiating property prices with buyers where needed, and defining project KPIs to expedite individual performance levels.

Job Location: Karachi

No. of Positions: 10

Min. Education: Bachelor’s in Business/Marketing or a related field

Experience: 4-6 years in Sales/Business Development",https://www.linkedin.com/jobs/view/2975260532/?eBP=CwEAAAGBI8VUmsvOF4nnuSrWsBD6NcytH8TAtUqqeda-Z6berTEdke_mDMeda240hAUr3HaHp8Vzth1u7xmCA0OJCFPjrOsLBk0qJim2C8TX0511J41TbNmgBT4hKxm-DFDt9sDtj_RPHWsSv72HbXuma4DJpXC5UxhC8nY3YeF1xv4wneBNxg1fXECiUUQT9OaMeEm43zioVYysng2GwJFk0GUf-IILHCuZYL9NW7RLZXGIpwDWIx86y24WqmvUn86CO8tJIds1hosGIGtJpGdHypTbk32zEN9i1pXty-th53egP5nmz8ViXBY7GkpC82vqRPF4ukZt4MAcxNdhSrSeiqu-nStqOw6U3z7gSayLICv6Bw0d_JKjz0b26dor9BPXM9A7&recommendedFlavor=SCHOOL_RECRUIT&refId=C1vrF6y%2BPU3G%2FOJ57WtbCQ%3D%3D&trackingId=ono8BDQ8r1ZD9odzs6mdwQ%3D%3D&trk=flagship3_search_srp_jobs,Assistant Manager - Project Sales,Zameen.com
102,102,"About LastingSales

We are the pioneer to introduce Cloud Contact Center solutions over Mobile networks in Pakistan. This solution is currently running in partnership with Zong. Currently, we are handling 6,000,000 calls/month, supporting 3500+ small and medium businesses (SMEs) with over 40,000+ sales agents. We are looking for multiple exceptional candidates to join our team and help us build the next generation of internal and external products.

The Role

Job Description
We are looking for a highly skilled computer programmer who is comfortable with both front and back end programming.
Full stack developers will be required to see out a project from conception to final product, requiring good organizational skills and attention to detail.
Laravel 100%

React JS 100%

Ideal Profile

Requirements
Strong organisational and project management skills.
Proficiency with fundamental front end languages such as HTML, CSS and JavaScript.
Familiarity with JavaScript frameworks such as Angular JS, React and Amber.
Proficiency with server side languages such as Python, Ruby, Java, PHP and .Net.
Familiarity with database technology such as MySQL, Oracle and MongoDB.
Excellent verbal communication skills.
Good problem solving skills.
Attention to detail.
What's on Offer?
Work alongside & learn from best in class talent
Attractive salary & benefits
Leadership Role",https://www.linkedin.com/jobs/view/3083322025/?eBP=JOB_SEARCH_ORGANIC&recommendedFlavor=JOB_SEEKER_QUALIFIED&refId=C1vrF6y%2BPU3G%2FOJ57WtbCQ%3D%3D&trackingId=XylUKntnMYtQVskve8zn9w%3D%3D&trk=flagship3_search_srp_jobs,Full Stack Developer,LastingSales
103,103,"Posted by
Aimen Khattak
Business Recruiter | HR Executive | Comp and Ben | HR Ops | HR Systems Development
Send InMail
What You'll Do:
Consistently achieve monthly and quarterly quota expectations
Proactively engage with customers to uncover their unique needs and help advise on the best solutions for their business
Demo KeepTruckin software to existing customer fleet managers for small fleets
Be a crucial component of the Expansion sales process and work in partnership with SDRs, CSMs, Support, OM, and other relevant departments to ensure an efficient and seamless customer experience
Adhere to daily assigned KPIs and attending customer meetings on time
What We're Looking For:
Upto 1 to 2 years in an inbound/outbound sales role, using both phone and email
Experience consulting with small business owners in the United States and Canada
The desire to work in a fast paced environment that requires initiative and autonomy
Highly organized and attach great importance to being punctual
Ability to learn about products and services and describe/explain them to prospects/customers
Excellent knowledge of English (vocabulary, comprehension, accent, tonality and articulation)
Excellent communication and interpersonal skills
Cool-tempered and able to handle rejection
Outstanding negotiation skills with the ability to resolve issues and address complaints
Understanding of sales funnel and stages",https://www.linkedin.com/jobs/view/2990272183/?eBP=CwEAAAGBI8VUmhZtxWWowXSlf-ppXuLEhpXsaOPOz-goEq1ZB7kItfa4FMpbwVpPe0tgxeH9wc1XRpmW3uxeUynFd37JXAANvQEnW7lbOheCYWKZx1PbfzNzUKICoHNdkbPvXp7DScGtPei-E9QpJ00U46j50PYDcXNLt_Uw1PuRL9Nuo5LYJ7Jw5XmSG1pwECgoyPzv2A_JnH7-gk8pCIE9ZTkBVwzoN2I4EnjkBfXWIPoV7I96CVSwwU7w00sVTKvGG4KNWW7zvlRnB5S3uiemi3TkWdF-9P8hMBU7pbU94OKJUdTAjCoDOoZK2ConH353FgZ7HVEJLr1U9kQsGwyKIo8v7dYJ4gnanXDesj7K7-1p2b9WJPF4grxUh2ZTeOGyNGzB&recommendedFlavor=JOB_SEEKER_QUALIFIED&refId=C1vrF6y%2BPU3G%2FOJ57WtbCQ%3D%3D&trackingId=r2pHcVbTTQhG%2BjxTjY0Xpg%3D%3D&trk=flagship3_search_srp_jobs,Sales Executive,Motive
104,104,"Last Date to Apply: 8th June, 2022.

Employment Type: This is a summer internship program.

Duration: 6 weeks.

Location: Islamabad, Lahore and Karachi.

Flexibility: Hybrid

Departments

Positions are open in the following departments:
Digital Transformation & CX
B2B Sales & Services
B2B Products & Solutions

Why should you join Telenor?

At Telenor Pakistan, we provide you the platform to work in a challenging and rewarding environment to become a skilled professional in your chosen field of interest. As one of the top employers of the country, we enable you to realize your dreams in a collaborative environment of diversity and openness to new mindsets.

As an equal employment opportunity provider, Telenor Pakistan makes all decisions of employment purely based on merit irrespective of race, caste, gender, creed, color, religion, sex, national origin, or disability.",https://www.linkedin.com/jobs/view/3096643522/?eBP=JOB_SEARCH_ORGANIC&recommendedFlavor=SCHOOL_RECRUIT&refId=C1vrF6y%2BPU3G%2FOJ57WtbCQ%3D%3D&trackingId=HOWc46p35heWfMGXV0%2F4aA%3D%3D&trk=flagship3_search_srp_jobs,Telenor Super Intern 2022 - Business,Telenor
105,105,"Division

Catalyst Computers Systems Ltd supply a dealer management system aimed primarily at the motorcycle, caravan and agricultural industries.

We help Dealers manage all areas of their business operations from parts and service, through to sales and finance, with innovative solutions to achieve their business objectives.

Position

We are looking for a Software Developer for Catalyst who will report to development team lead. Job is to develop high quality and robust software. Developing a dealership management solution, using a mix of modern programming languages and techniques as well as maintaining a large legacy codebase. Produce readable, maintainable code that is both manually and automatically tested in all target environments. Use an Agile approach and appropriate methodologies to support collaboration and manage change. To follow the departmental processes in relation to software development.

The chosen candidate will work out of the Contour Software Islamabad resource centre office, as an extension of the division-based R&D department

Key Responsibilities
Design and create new code to extend our existing products, to standards agreed by the development team.
Contribute to software design and supporting documentation.
Work as a part of a development team, following agile methods agreed by the team.
Understand the development techniques that relate to the delivery of the existing and new products.
Test code both manually and using automated methods (unit, integration and UI testing).
Review code created/editing by other developers, ensuring that the code conforms to coding standards, matches the documented requirements and does not introduce defects.
Work with QA team to ensure features and defect resolutions match corresponding test scenarios.
Ensure code components pass continual delivery testing and resolve any identified defects.
Follow agreed and documented coding best practices, ensuring full understanding and development requirements.
Assist QA/support with defect investigation, steps to reproduce defect, and provide a solution to resolve any defect identified.
Become involved in ad-hoc tasks as required to achieve team goals.
Qualifications Required

Desirable Bachelor's degree in Computer Science or equivalent work experience.

Experience And Skills Required

Essential - Good Working knowledge of the English language

Essential - Good communication skills, both verbally and in writing

)

Essential - Experience with SQL (MariaDB, SQLite, etc.

Desirable - Experience with C# and the .NET framework

Desirable - Experience with a JavaScript web framework (Angular, PHP etc)

Desirable - Willingness to learn different programming languages and paradigms

Desirable - Experience of working with Agile methodologies (Kanban or SCRUM)

Desirable - Experience with Financial (Accounting) systems

Suitable for someone who...

Is passionate about creating and maintaining quality software. Has an understanding of the workflow involved in development. Is pragmatic and a good problem solver.

Competencies Communication I can effectively communicate with people at all levels both internally and externally Effective I can work both independently and collaboratively to achieve my goals Precise I am accurate in my communication and exact in my delivery Tenacious I ensure that all tasks on a project are seen through to completion Credible I know what I'm talking about and can back this up with evidence Positive I convey an optimistic and confident approach to situations Interested I want to learn more about what I and the company does Committed I do what I say I'll do; people can count on me Respectful I treat colleagues and customers with deference and respect Collaborative I work well with others to get the desired outcome

Exciting Benefits We Offer
Market-leading Salary
Medical Coverage Self & Dependents
Parents Medical Coverage
Provident Fund
Employee Performance-based bonuses
Home Internet Subsidy
Conveyance Allowance
Profit Sharing Plan [Tenured Employees Only]
Life Benefit
Child Care Facility
Company Provided Lunch/Dinner
Professional Development Budget
Recreational area for in-house games
Sporadic On-shore training opportunities
Friendly work environment
Leave Encashment",https://www.linkedin.com/jobs/view/3068136795/?eBP=JOB_SEARCH_ORGANIC&recommendedFlavor=SCHOOL_RECRUIT&refId=C1vrF6y%2BPU3G%2FOJ57WtbCQ%3D%3D&trackingId=Ee0EQL3JSWtYB6m55N6ZBA%3D%3D&trk=flagship3_search_srp_jobs,Software Developer,Contour Software
106,106,"Posted by
malik hamza
HR EXECUTIVE IN RUBA DIGITAL
Send InMail
Basic Requirements:

•Qualification: Graduation
•Experience: 2-3 years’ experience in retail industry preferably consumer electronics
•Good confidence level
• Excellent communication skills
• Local residents will be given preference
•Must have own conveyance

MAJOR TASKS:

•Actively seek out new sales opportunities
•Generate Sales
•Customer Dealing
Knowledge of handling Social Media Activities",https://www.linkedin.com/jobs/view/3068091799/?eBP=JOB_SEARCH_ORGANIC&recommendedFlavor=JOB_SEEKER_QUALIFIED&refId=C1vrF6y%2BPU3G%2FOJ57WtbCQ%3D%3D&trackingId=zwsuLPxlouIEsK8f3BAANg%3D%3D&trk=flagship3_search_srp_jobs,Sales Executive,"RD, Ruba Digital PVT. LTD."
107,107,"POSITION: Marketing Intern

LOCATION: Remote

SCHEDULE: Part-time (10-20h/week)

About Brainnest

The business management and training company headquartered in Bremen, Germany. We are a success-driven firm that provides management advisory and contracting services customized to help companies from different industries with business management problems. Brainnest runs, leads, and manages complex projects and initiatives. We have begun from scratch when a network of professionals, Ph.D. holders, and highly skilled personnel bring to a business table their practical and academic years of experience to form up a concrete blueprint on which the company has been designed. Since 2020, we offer a combination of expertise, proficiency, and commitment leveraging our deep industry experience, along with using analytical rigor to drive outstanding results for businesses. We proudly provide top-class consulting and training services for a wide range of industries around the world. A well-equipped team, advanced tools, and modern methodologies are some of what we correctly utilize to offer our clients what makes them the best in their fields.

Our team is looking for a Marketing Intern to join them in the upcoming weeks. This position is great for an aspiring marketing professional looking to work on business-critical projects and gain relevant work experience.

Your Profile
Strong communication skills with the ability to discuss any issues with a wide variety of individuals and groups
Capability to produce content on time, with attention to detail, and an emphasis on identifying and pitching to a target audience
A well-organized team player with the ability to perform various tasks, act individually, and think creatively
Familiarity with Microsoft applications and Zoom
Willingness to learn and develop marketing skills
Competitive and proactive attitude
Fluency in English
You Will Learn How To
Design and execute marketing and promotional campaigns for clients
Interact with clients and customers with a professional and enthusiastic demeanor to build relationships and increase sales margins
Monitor digital marketing campaigns based on goals and KPIs
Generate new leads to grow company revenue
Develop your professional skills to grow both within the company and on your own
Work directly with the marketing and sales team to accomplish tasks assigned by senior management
Build and maintain trusting relationships with new and existing customers
Present ideas to the sales and marketing team and other operational areas within the organization to improve sales processes and marketing procedures to ensure we are operating efficiently and effectively
Support the marketing team with daily administrative tasks
At Brainnest, we’re committed to equal employment opportunity regardless of race, color, ancestry, religion, sex, national origin, sexual orientation, age, citizenship, marital status, disability, gender, gender identity or expression, or veteran status. We strive to be a more equal opportunity workplace.",https://www.linkedin.com/jobs/view/3099508191/?eBP=JOB_SEARCH_ORGANIC&refId=C1vrF6y%2BPU3G%2FOJ57WtbCQ%3D%3D&trackingId=Gz3OuFwI1U2onA1sy9nPMg%3D%3D&trk=flagship3_search_srp_jobs,Intern/Junior Marketing Specialist (Remote Internship),Brainnest
